{
  "$schema": "https://raw.githubusercontent.com/Harzva/ascend-modelagent-completed/main/schema/competition-feedback-v1.schema.json",
  "schema_version": "1.0",
  "competition_id": "2083120580017467393",
  "generated_at": "2026-08-18T11:05:24+08:00",
  "source": {
    "url": "https://competition.gitcode.com/competition/2083120580017467393/publish",
    "total_score": 7000,
    "submission_count": 79
  },
  "summary": {
    "open_model_count": 9,
    "open_issue_count": 9
  },
  "items": [
    {
      "id": "repair-ff8703df1cf837c9",
      "status": "open",
      "priority": "high",
      "model_id": "ibm-research/flowstate",
      "original_model_url": "https://huggingface.co/ibm-research/flowstate",
      "project_url": "https://gitcode.com/harzva/flowstate-npu",
      "repo_slug": "harzva/flowstate-npu",
      "submission_number": 76,
      "submitted_at": "2026-08-18 10:59:39",
      "first_seen_at": "2026-08-18T11:05:24+08:00",
      "last_seen_at": "2026-08-18T11:05:24+08:00",
      "issues": [
        {
          "id": "issue-03651faa88e68e88",
          "code": "missing_required_files",
          "severity": "high",
          "message": "作品仓库缺少必需文件：assets/agent_workflow.png、assets/npu_device_call.png、assets/model_result.png",
          "paths": [
            "assets/agent_workflow.png",
            "assets/model_result.png",
            "assets/npu_device_call.png"
          ]
        }
      ],
      "repair_contract": {
        "target_repository": "https://gitcode.com/harzva/flowstate-npu",
        "actions": [
          "补齐缺失的必需文件：assets/agent_workflow.png、assets/model_result.png、assets/npu_device_call.png"
        ],
        "verification": [
          "确认模型仓库中可匿名访问全部必需文件",
          "基于真实 Model Agent/NPU 日志核验三张截图内容",
          "修复推送后写入 feedback/receipts/<repo-name>.json"
        ],
        "constraints": [
          "只修改 target_repository 指向的模型仓库",
          "不得输出或提交 token、Cookie、.env、访问文件、凭据或本机私有路径",
          "截图和验证证据必须来自真实适配过程或真实 NPU 运行，禁止伪造"
        ]
      },
      "model_feedback_path": "feedback/models/flowstate-npu.json",
      "receipt_path": "feedback/receipts/flowstate-npu.json"
    },
    {
      "id": "repair-129c4466c113239f",
      "status": "open",
      "priority": "high",
      "model_id": "ibm-granite/granite-timeseries-flowstate-r1",
      "original_model_url": "https://huggingface.co/ibm-granite/granite-timeseries-flowstate-r1",
      "project_url": "https://gitcode.com/harzva/granite-timeseries-flowstate-r1-npu",
      "repo_slug": "harzva/granite-timeseries-flowstate-r1-npu",
      "submission_number": 75,
      "submitted_at": "2026-08-18 10:58:25",
      "first_seen_at": "2026-08-18T11:05:24+08:00",
      "last_seen_at": "2026-08-18T11:05:24+08:00",
      "issues": [
        {
          "id": "issue-5cf8d8b97e66a805",
          "code": "missing_required_files",
          "severity": "high",
          "message": "作品仓库缺少必需文件：assets/agent_workflow.png、assets/npu_device_call.png、assets/model_result.png",
          "paths": [
            "assets/agent_workflow.png",
            "assets/model_result.png",
            "assets/npu_device_call.png"
          ]
        }
      ],
      "repair_contract": {
        "target_repository": "https://gitcode.com/harzva/granite-timeseries-flowstate-r1-npu",
        "actions": [
          "补齐缺失的必需文件：assets/agent_workflow.png、assets/model_result.png、assets/npu_device_call.png"
        ],
        "verification": [
          "确认模型仓库中可匿名访问全部必需文件",
          "基于真实 Model Agent/NPU 日志核验三张截图内容",
          "修复推送后写入 feedback/receipts/<repo-name>.json"
        ],
        "constraints": [
          "只修改 target_repository 指向的模型仓库",
          "不得输出或提交 token、Cookie、.env、访问文件、凭据或本机私有路径",
          "截图和验证证据必须来自真实适配过程或真实 NPU 运行，禁止伪造"
        ]
      },
      "model_feedback_path": "feedback/models/granite-timeseries-flowstate-r1-npu.json",
      "receipt_path": "feedback/receipts/granite-timeseries-flowstate-r1-npu.json"
    },
    {
      "id": "repair-a04bce3dd682cd97",
      "status": "open",
      "priority": "high",
      "model_id": "fixie-ai/ultraVAD",
      "original_model_url": "https://huggingface.co/fixie-ai/ultraVAD",
      "project_url": "https://gitcode.com/harzva/ultravad-npu",
      "repo_slug": "harzva/ultravad-npu",
      "submission_number": 74,
      "submitted_at": "2026-08-11 22:02:37",
      "first_seen_at": "2026-08-11T22:04:48+08:00",
      "last_seen_at": "2026-08-18T11:05:24+08:00",
      "issues": [
        {
          "id": "issue-e016266cba2b4ec7",
          "code": "missing_required_files",
          "severity": "high",
          "message": "作品仓库缺少必需文件：assets/agent_workflow.png、assets/npu_device_call.png、assets/model_result.png",
          "paths": [
            "assets/agent_workflow.png",
            "assets/model_result.png",
            "assets/npu_device_call.png"
          ]
        }
      ],
      "repair_contract": {
        "target_repository": "https://gitcode.com/harzva/ultravad-npu",
        "actions": [
          "补齐缺失的必需文件：assets/agent_workflow.png、assets/model_result.png、assets/npu_device_call.png"
        ],
        "verification": [
          "确认模型仓库中可匿名访问全部必需文件",
          "基于真实 Model Agent/NPU 日志核验三张截图内容",
          "修复推送后写入 feedback/receipts/<repo-name>.json"
        ],
        "constraints": [
          "只修改 target_repository 指向的模型仓库",
          "不得输出或提交 token、Cookie、.env、访问文件、凭据或本机私有路径",
          "截图和验证证据必须来自真实适配过程或真实 NPU 运行，禁止伪造"
        ]
      },
      "model_feedback_path": "feedback/models/ultravad-npu.json",
      "receipt_path": "feedback/receipts/ultravad-npu.json"
    },
    {
      "id": "repair-5fb8deed7ade230e",
      "status": "open",
      "priority": "medium",
      "model_id": "multimolecule/borzoi-human",
      "original_model_url": "https://huggingface.co/multimolecule/borzoi-human",
      "project_url": "https://gitcode.com/harzva/borzoi-human-npu",
      "repo_slug": "harzva/borzoi-human-npu",
      "submission_number": 71,
      "submitted_at": "2026-08-11 17:31:12",
      "first_seen_at": "2026-08-11T17:37:01+08:00",
      "last_seen_at": "2026-08-18T11:05:24+08:00",
      "issues": [
        {
          "id": "issue-47ee0052e2028ada",
          "code": "competition_low_score_reminder",
          "severity": "medium",
          "message": "作品仓库 README 为空，跳过计分",
          "paths": []
        }
      ],
      "repair_contract": {
        "target_repository": "https://gitcode.com/harzva/borzoi-human-npu",
        "actions": [
          "按比赛低分提醒修复：作品仓库 README 为空，跳过计分"
        ],
        "verification": [
          "重新打开比赛查看结果，确认对应提醒消失",
          "修复推送后写入 feedback/receipts/<repo-name>.json"
        ],
        "constraints": [
          "只修改 target_repository 指向的模型仓库",
          "不得输出或提交 token、Cookie、.env、访问文件、凭据或本机私有路径",
          "截图和验证证据必须来自真实适配过程或真实 NPU 运行，禁止伪造"
        ]
      },
      "model_feedback_path": "feedback/models/borzoi-human-npu.json",
      "receipt_path": "feedback/receipts/borzoi-human-npu.json"
    },
    {
      "id": "repair-d915e1d2bd324ef0",
      "status": "open",
      "priority": "medium",
      "model_id": "multimolecule/borzoi-mouse",
      "original_model_url": "https://huggingface.co/multimolecule/borzoi-mouse",
      "project_url": "https://gitcode.com/harzva/borzoi-mouse-npu",
      "repo_slug": "harzva/borzoi-mouse-npu",
      "submission_number": 73,
      "submitted_at": "2026-08-11 17:32:15",
      "first_seen_at": "2026-08-11T17:37:01+08:00",
      "last_seen_at": "2026-08-18T11:05:24+08:00",
      "issues": [
        {
          "id": "issue-0f4534afbd5251fe",
          "code": "competition_low_score_reminder",
          "severity": "medium",
          "message": "作品仓库 README 为空，跳过计分",
          "paths": []
        }
      ],
      "repair_contract": {
        "target_repository": "https://gitcode.com/harzva/borzoi-mouse-npu",
        "actions": [
          "按比赛低分提醒修复：作品仓库 README 为空，跳过计分"
        ],
        "verification": [
          "重新打开比赛查看结果，确认对应提醒消失",
          "修复推送后写入 feedback/receipts/<repo-name>.json"
        ],
        "constraints": [
          "只修改 target_repository 指向的模型仓库",
          "不得输出或提交 token、Cookie、.env、访问文件、凭据或本机私有路径",
          "截图和验证证据必须来自真实适配过程或真实 NPU 运行，禁止伪造"
        ]
      },
      "model_feedback_path": "feedback/models/borzoi-mouse-npu.json",
      "receipt_path": "feedback/receipts/borzoi-mouse-npu.json"
    },
    {
      "id": "repair-3bf96d8c6a5c382b",
      "status": "open",
      "priority": "medium",
      "model_id": "multimolecule/enformer",
      "original_model_url": "https://huggingface.co/multimolecule/enformer",
      "project_url": "https://gitcode.com/harzva/enformer-npu",
      "repo_slug": "harzva/enformer-npu",
      "submission_number": 72,
      "submitted_at": "2026-08-11 17:31:44",
      "first_seen_at": "2026-08-11T17:37:01+08:00",
      "last_seen_at": "2026-08-18T11:05:24+08:00",
      "issues": [
        {
          "id": "issue-a76d775690d20c85",
          "code": "competition_low_score_reminder",
          "severity": "medium",
          "message": "作品仓库 README 为空，跳过计分",
          "paths": []
        }
      ],
      "repair_contract": {
        "target_repository": "https://gitcode.com/harzva/enformer-npu",
        "actions": [
          "按比赛低分提醒修复：作品仓库 README 为空，跳过计分"
        ],
        "verification": [
          "重新打开比赛查看结果，确认对应提醒消失",
          "修复推送后写入 feedback/receipts/<repo-name>.json"
        ],
        "constraints": [
          "只修改 target_repository 指向的模型仓库",
          "不得输出或提交 token、Cookie、.env、访问文件、凭据或本机私有路径",
          "截图和验证证据必须来自真实适配过程或真实 NPU 运行，禁止伪造"
        ]
      },
      "model_feedback_path": "feedback/models/enformer-npu.json",
      "receipt_path": "feedback/receipts/enformer-npu.json"
    },
    {
      "id": "repair-61bf009fce9ada59",
      "status": "open",
      "priority": "medium",
      "model_id": "Datadog/Toto-2.0-22m",
      "original_model_url": "https://huggingface.co/Datadog/Toto-2.0-22m",